status	name	score	runtime_seconds	changed_files	diff_summary	run_command	artifacts	failure_reason	candidate_manifest	base_candidate	patch_sha256	metric_name	metric_source	metric_artifact	candidate_kind	algorithm_family	literature_event_id
baseline	baseline	0.821000	1180.512	none	imported job.py baseline	python job.py	autofl_runs/baseline					val_accuracy	server_log	autofl_runs/baseline/run.log		fedavg
keep	fedavg-lr-0.01	0.835400	1176.240	none	tunable client lr 0.05 -> 0.01	python job.py	autofl_runs/fedavg-lr-0.01		.nvflare/autofl/candidates/fedavg-lr-0.01/candidate_manifest.json	baseline		val_accuracy	server_log	autofl_runs/fedavg-lr-0.01/run.log	argument_only	fedavg
discard	fedavg-lr-0.001	0.812100	1179.083	none	tunable client lr 0.01 -> 0.001	python job.py	autofl_runs/fedavg-lr-0.001		.nvflare/autofl/candidates/fedavg-lr-0.001/candidate_manifest.json	fedavg-lr-0.01		val_accuracy	server_log	autofl_runs/fedavg-lr-0.001/run.log	argument_only	fedavg
discard	fedavg-batch-64	0.829800	1148.667	none	tunable client batch size 32 -> 64	python job.py	autofl_runs/fedavg-batch-64		.nvflare/autofl/candidates/fedavg-batch-64/candidate_manifest.json	fedavg-lr-0.01		val_accuracy	server_log	autofl_runs/fedavg-batch-64/run.log	argument_only	fedavg
discard	fedavg-weight-decay-1e-4	0.828100	1182.951	none	tunable client weight decay 0 -> 1e-4	python job.py	autofl_runs/fedavg-weight-decay-1e-4		.nvflare/autofl/candidates/fedavg-weight-decay-1e-4/candidate_manifest.json	fedavg-lr-0.01		val_accuracy	server_log	autofl_runs/fedavg-weight-decay-1e-4/run.log	argument_only	fedavg
literature	lit-0001-fedprox-review		0.000	none	sources: FedProx (arXiv:1812.06127); decision: client proximal-term exploration batch under the fixed comparison budget							val_accuracy				fedprox	lit-0001
keep	fedprox-mu-0.01-faithful	0.841200	1201.774	client.py	add FedProx proximal term mu=0.01 to the local training loss	python job.py	autofl_runs/fedprox-mu-0.01-faithful		.nvflare/autofl/candidates/fedprox-mu-0.01-faithful/candidate_manifest.json	fedavg-lr-0.01	7c1de0aa5b3f4c2d8e9f0a1b2c3d4e5f6a7b8c9d0e1f2a3b4c5d6e7f8a9b0c1d	val_accuracy	server_log	autofl_runs/fedprox-mu-0.01-faithful/run.log	source_edit	fedprox	lit-0001
